{"$schema":"https://json-schema.org/draft/2020-12/schema","$id":"https://playaig.com/schemas/acquisition-manifest.schema.json","type":"object","additionalProperties":false,"required":["manifestId","sourceId","entityType","entityIdCandidate","rawData","extractedFields","fieldEvidence","sourceLocator","extractionDate","operator","confidenceScore","status"],"properties":{"manifestId":{"type":"string","pattern":"^manifest-[a-z0-9]+(?:-[a-z0-9]+)*$"},"sourceId":{"type":"string","pattern":"^[a-z][a-z0-9]*(?:-[a-z0-9]+)*$"},"entityType":{"enum":["card","cards","equipment","skill","skills","monster","monsters","bosses","maps"]},"entityIdCandidate":{"type":["string","null"]},"rawData":{"type":"object"},"extractedFields":{"type":"object"},"fieldEvidence":{"type":"object","additionalProperties":{"type":["string","object","array"]}},"sourceLocator":{"type":["string","object"],"minLength":1},"extractionDate":{"type":"string","format":"date-time"},"operator":{"type":"string","minLength":1},"confidenceScore":{"type":"number","minimum":0,"maximum":100},"status":{"enum":["draft","validation","review","approved","rejected"]},"reviewNotes":{"type":["string","null"]},"reviewer":{"type":["string","null"]},"reviewDate":{"type":["string","null","object"]}}}
